{
    "$schema": "http://json-schema.org/draft-04/schema",
    "type": "array",
    "items": {
        "type": "object",
        "properties": {
            "storeCode": {
                "type": "string"
            },
            "distributorCode": {
                "type": ["string", "null"]
            },
            "distributorName": {
                "type": ["string", "null"]
            },
            "contactType": {
                "type": "string"
            },
            "position": {
                "type": "string"
            },
            "name": {
                "type": "string"
            },
            "phone": {
                "type": ["string", "null"]
            },
            "email": {
                "type": "string"
            }
        },
        "required": ["storeCode", "distributorCode", "distributorName", "contactType", "position", "name", "phone", "email"]
    },
    "required": true
}